{
  "$schema": "https://json-schema.org/draft/2020-12/schema",
  "$id": "governance.route/v1",
  "title": "Governance OS route manifest v1",
  "type": "object",
  "additionalProperties": false,
  "required": [
    "schema", "route_id", "task_board", "wave", "generation",
    "parent_route_id", "expected_control_head", "created_at", "created_by",
    "target", "packet_refs", "packet_delta", "capability_refs",
    "capacity_split", "prohibitions", "side_effect_token",
    "join_condition", "next_trigger"
  ],
  "properties": {
    "schema": { "const": "governance.route/v1" },
    "route_id": {
      "type": "string",
      "pattern": "^[^/\\s]+-coordinator-to-all-[^/\\s]+$",
      "description": "Mailbox filename stem; the .md and .route.json pair share it."
    },
    "task_board": { "type": "string", "minLength": 1 },
    "wave": { "type": "integer", "minimum": 1 },
    "generation": {
      "type": "integer", "minimum": 1,
      "description": "Reserved for P0.3; shape-validated only in v1 slice 1."
    },
    "parent_route_id": {
      "type": ["string", "null"],
      "description": "Null iff generation == 1."
    },
    "expected_control_head": {
      "type": ["string", "null"], "pattern": "^[0-9a-f]{7,40}$",
      "description": "Reserved for P0.3 CAS; shape-validated only in slice 1."
    },
    "created_at": {
      "type": "string",
      "pattern": "^\\d{4}-\\d{2}-\\d{2}T\\d{2}:\\d{2}:\\d{2}Z$"
    },
    "created_by": {
      "enum": ["director", "director2", "operator", "operator2", "coordinator", "coordinator2"]
    },
    "target": {
      "type": ["object", "null"],
      "additionalProperties": false,
      "required": ["repository", "base_commit", "worktree"],
      "properties": {
        "repository": { "type": "string", "minLength": 1 },
        "base_commit": { "type": "string", "pattern": "^[0-9a-f]{7,40}$" },
        "worktree": { "type": ["string", "null"] }
      }
    },
    "packet_refs": {
      "type": "array", "minItems": 1, "uniqueItems": true,
      "items": { "type": "string", "minLength": 1 },
      "description": "Capacity-packet IDs. Packets stay the assignment/state source (P0.2 pending)."
    },
    "packet_delta": {
      "type": "null",
      "description": "Reserved for P1.3-lite (cycle delta + inventory digest). Must be null in v1.0."
    },
    "capability_refs": {
      "type": "array", "maxItems": 0,
      "description": "Reserved for P0.4 capability objects. Must be [] in v1.0."
    },
    "capacity_split": {
      "type": "object",
      "oneOf": [
        {
          "additionalProperties": false,
          "required": ["mode"],
          "properties": { "mode": { "const": "single_pair" } }
        },
        {
          "additionalProperties": false,
          "required": ["mode", "chunk_a", "chunk_b"],
          "properties": {
            "mode": { "const": "dual_pair" },
            "chunk_a": { "type": "array", "minItems": 1, "items": { "type": "string" } },
            "chunk_b": { "type": "array", "minItems": 1, "items": { "type": "string" } }
          }
        }
      ]
    },
    "prohibitions": {
      "type": "array", "uniqueItems": true,
      "items": {
        "enum": [
          "remote_ref_update", "lock_action", "paid_spend", "pod_action",
          "production_generation", "target_checkout_refresh",
          "cursor_consume", "route_mutation", "canonical_database_mutation"
        ]
      }
    },
    "side_effect_token": {
      "type": ["object", "null"],
      "additionalProperties": false,
      "required": [
        "side_effect_id", "executor", "target", "allowed_command_class",
        "preflight", "stop_if_newer_mail_or_live_target_satisfied",
        "postcheck", "observer_seats", "final_closeout_owner", "non_goals"
      ],
      "properties": {
        "side_effect_id": { "type": "string", "minLength": 1 },
        "executor": {
          "enum": ["director", "director2", "operator", "operator2", "coordinator", "coordinator2"]
        },
        "target": { "type": "string", "minLength": 1 },
        "allowed_command_class": { "type": "string", "minLength": 1 },
        "preflight": { "type": "string", "minLength": 1 },
        "stop_if_newer_mail_or_live_target_satisfied": { "type": "string", "minLength": 1 },
        "postcheck": { "type": "string", "minLength": 1 },
        "observer_seats": { "type": "string", "minLength": 1 },
        "final_closeout_owner": { "type": "string", "minLength": 1 },
        "non_goals": { "type": "string", "minLength": 1 }
      }
    },
    "join_condition": { "type": "string", "minLength": 1 },
    "next_trigger": { "type": "string", "minLength": 1 },
    "extensions": {
      "type": "object",
      "description": "Namespaced experimental data. Never authority-bearing."
    }
  }
}
