{
  "schema": "governance.route/v1",
  "route_id": "2026-07-11T20-02-00Z-coordinator-to-all-coordination",
  "task_board": "route-compat-cycle",
  "wave": 2,
  "generation": 1,
  "parent_route_id": null,
  "expected_control_head": null,
  "created_at": "2026-07-11T20:00:00Z",
  "created_by": "coordinator",
  "target": null,
  "packet_refs": [
    "coord-capacity-split-route",
    "director-capacity-split-chunk-a",
    "operator-capacity-split-chunk-a",
    "director2-capacity-split-work",
    "operator2-capacity-split-work"
  ],
  "packet_delta": null,
  "capability_refs": [],
  "capacity_split": {
    "mode": "single_pair"
  },
  "prohibitions": [
    "remote_ref_update"
  ],
  "side_effect_token": {
    "side_effect_id": "publish-main-2026-07-11",
    "executor": "director",
    "target": "origin/main",
    "allowed_command_class": "git push",
    "preflight": "git status plus divergence check",
    "stop_if_newer_mail_or_live_target_satisfied": "re-read mailbox and ls-remote",
    "postcheck": "git ls-remote origin refs/heads/main",
    "observer_seats": "director2, operator, operator2",
    "final_closeout_owner": "coordinator",
    "non_goals": "no force-push and no lock claim"
  },
  "join_condition": "coordinator closes after both pair lanes are accounted for.",
  "next_trigger": "Director continues Chunk A; Pair B follows the capacity split decision."
}
